"Story","Title","Result","Date","Stability","Duration (s)"
"Dropdown","shows the placeholder when no option is selected yet","SUCCESS","2023-09-04T21:16:42.378Z[Etc/UTC]","0.0","1.34"
"Dropdown","shows the available options when the menu is expanded","SUCCESS","2023-09-04T21:16:43.733Z[Etc/UTC]","0.0","0.75"
"Dropdown","selects the desired options","SUCCESS","2023-09-04T21:16:44.494Z[Etc/UTC]","0.0","2.01"
"Dropdown","triggers onChange with selected options","SUCCESS","2023-09-04T21:16:46.518Z[Etc/UTC]","0.0","2.22"
"Dropdown","allows for selected options to be deselected","SUCCESS","2023-09-04T21:16:48.754Z[Etc/UTC]","0.0","3.07"
"Dropdown","goes back to showing the placeholder when all the selected options get deselected","SUCCESS","2023-09-04T21:16:51.85Z[Etc/UTC]","0.0","2.79"
