"Story","Title","Result","Date","Stability","Duration (s)"
"Dropdown","shows the placeholder when no option is selected yet","SUCCESS","2023-08-25T15:30:11.125Z[Etc/UTC]","0.0","1.54"
"Dropdown","selects the desired options","SUCCESS","2023-08-25T15:30:13.465Z[Etc/UTC]","0.0","1.98"
"Dropdown","triggers onChange with selected options","SUCCESS","2023-08-25T15:30:15.455Z[Etc/UTC]","0.0","2.1"
"Dropdown","allows for selected options to be deselected","SUCCESS","2023-08-25T15:30:17.587Z[Etc/UTC]","0.0","3.01"
"Dropdown","goes back to showing the placeholder when all the selected options get deselected","SUCCESS","2023-08-25T15:30:20.61Z[Etc/UTC]","0.0","2.75"
