"Story","Title","Result","Date","Stability","Duration (s)"
"Dropdown","shows the placeholder when no option is selected yet","SUCCESS","2023-10-03T22:11:49.632Z[Etc/UTC]","0.0","0.77"
"Dropdown","shows the available options when the menu is expanded","SUCCESS","2023-10-03T22:11:50.405Z[Etc/UTC]","0.0","0.76"
"Dropdown","selects the desired options","SUCCESS","2023-10-03T22:11:51.173Z[Etc/UTC]","0.0","1.66"
"Dropdown","triggers onChange with selected options","SUCCESS","2023-10-03T22:11:52.843Z[Etc/UTC]","0.0","1.82"
"Dropdown","allows for selected options to be deselected","SUCCESS","2023-10-03T22:11:54.699Z[Etc/UTC]","0.0","2.7"
"Dropdown","goes back to showing the placeholder when all the selected options get deselected","SUCCESS","2023-10-03T22:11:57.423Z[Etc/UTC]","0.0","2.38"
